{
  "id": "summit-valley-rampart",
  "name": "Summit Valley Rampart",
  "abbrev": "SVR",
  "players": [
    {
      "name": "Reggie Calhoun",
      "number": 1,
      "position": "PG",
      "height": 6.2,
      "attributes": {
        "speed": 80,
        "handleRight": 88,
        "handleLeft": 72,
        "pass": 92,
        "three": 70,
        "mid": 80,
        "finishing": 72,
        "perimD": 74,
        "steal": 72,
        "iq": 91,
        "strength": 60,
        "weight": 195,
        "vertical": 66,
        "rebound": 46,
        "interiorD": 48,
        "block": 36
      },
      "tendencies": {
        "shootThree": 38,
        "shootMid": 50,
        "driveRim": 48,
        "pass": 88,
        "postUp": 10,
        "screen": 30,
        "helpDefense": 52,
        "gambleSteal": 48,
        "crashGlass": 28,
        "pushTransition": 45
      }
    },
    {
      "name": "Drew Hanover",
      "number": 22,
      "position": "SG",
      "height": 6.5,
      "attributes": {
        "speed": 76,
        "handleRight": 74,
        "handleLeft": 56,
        "pass": 66,
        "three": 78,
        "mid": 84,
        "finishing": 78,
        "perimD": 70,
        "steal": 64,
        "iq": 80,
        "strength": 66,
        "weight": 210,
        "vertical": 74,
        "rebound": 52,
        "interiorD": 54,
        "block": 44
      },
      "tendencies": {
        "shootThree": 50,
        "shootMid": 65,
        "driveRim": 45,
        "pass": 48,
        "postUp": 18,
        "screen": 28,
        "helpDefense": 50,
        "gambleSteal": 42,
        "crashGlass": 35,
        "pushTransition": 48
      }
    },
    {
      "name": "Malik Osei",
      "number": 9,
      "position": "SF",
      "height": 6.7,
      "attributes": {
        "speed": 78,
        "handleRight": 64,
        "handleLeft": 46,
        "pass": 60,
        "three": 70,
        "mid": 72,
        "finishing": 80,
        "perimD": 86,
        "steal": 78,
        "iq": 80,
        "strength": 76,
        "weight": 228,
        "vertical": 82,
        "rebound": 66,
        "interiorD": 72,
        "block": 64
      },
      "tendencies": {
        "shootThree": 52,
        "shootMid": 32,
        "driveRim": 50,
        "pass": 42,
        "postUp": 18,
        "screen": 30,
        "helpDefense": 82,
        "gambleSteal": 62,
        "crashGlass": 48,
        "pushTransition": 50
      }
    },
    {
      "name": "Grant Whitaker",
      "number": 44,
      "position": "PF",
      "height": 6.83,
      "attributes": {
        "speed": 66,
        "handleLeft": 54,
        "handleRight": 38,
        "pass": 58,
        "three": 56,
        "mid": 76,
        "finishing": 84,
        "perimD": 64,
        "steal": 56,
        "iq": 78,
        "strength": 82,
        "weight": 250,
        "vertical": 76,
        "rebound": 82,
        "interiorD": 78,
        "block": 70
      },
      "tendencies": {
        "shootThree": 28,
        "shootMid": 55,
        "driveRim": 48,
        "pass": 44,
        "postUp": 58,
        "screen": 62,
        "helpDefense": 66,
        "gambleSteal": 36,
        "crashGlass": 70,
        "pushTransition": 38
      }
    },
    {
      "name": "Viktor Petrov",
      "number": 55,
      "position": "C",
      "height": 7.08,
      "attributes": {
        "speed": 56,
        "handleRight": 44,
        "handleLeft": 30,
        "pass": 56,
        "three": 32,
        "mid": 58,
        "finishing": 88,
        "perimD": 52,
        "steal": 46,
        "iq": 76,
        "strength": 90,
        "weight": 295,
        "vertical": 74,
        "rebound": 90,
        "interiorD": 88,
        "block": 86
      },
      "tendencies": {
        "shootThree": 5,
        "shootMid": 25,
        "driveRim": 42,
        "pass": 40,
        "postUp": 70,
        "screen": 76,
        "helpDefense": 80,
        "gambleSteal": 28,
        "crashGlass": 88,
        "pushTransition": 30
      }
    },
    {
      "name": "Devon Pryce",
      "number": 12,
      "position": "SF",
      "height": 6.6,
      "attributes": {
        "speed": 84,
        "handleRight": 76,
        "handleLeft": 58,
        "pass": 62,
        "three": 62,
        "mid": 70,
        "finishing": 86,
        "perimD": 68,
        "steal": 66,
        "iq": 72,
        "strength": 70,
        "weight": 218,
        "vertical": 88,
        "rebound": 58,
        "interiorD": 62,
        "block": 56
      },
      "tendencies": {
        "shootThree": 34,
        "shootMid": 42,
        "driveRim": 82,
        "pass": 38,
        "postUp": 20,
        "screen": 26,
        "helpDefense": 54,
        "gambleSteal": 56,
        "crashGlass": 50,
        "pushTransition": 62
      }
    },
    {
      "name": "Nate Forsythe",
      "number": 6,
      "position": "PG",
      "height": 6.08,
      "attributes": {
        "speed": 82,
        "handleRight": 78,
        "handleLeft": 61,
        "pass": 74,
        "three": 76,
        "mid": 68,
        "finishing": 62,
        "perimD": 68,
        "steal": 72,
        "iq": 74,
        "strength": 54,
        "weight": 178,
        "vertical": 64,
        "rebound": 42,
        "interiorD": 46,
        "block": 34
      },
      "tendencies": {
        "shootThree": 56,
        "shootMid": 36,
        "driveRim": 46,
        "pass": 66,
        "postUp": 8,
        "screen": 22,
        "helpDefense": 50,
        "gambleSteal": 62,
        "crashGlass": 26,
        "pushTransition": 58
      }
    },
    {
      "name": "Hassan Toure",
      "number": 32,
      "position": "C",
      "height": 6.92,
      "attributes": {
        "speed": 62,
        "handleRight": 42,
        "handleLeft": 30,
        "pass": 50,
        "three": 36,
        "mid": 52,
        "finishing": 82,
        "perimD": 54,
        "steal": 48,
        "iq": 70,
        "strength": 84,
        "weight": 265,
        "vertical": 78,
        "rebound": 82,
        "interiorD": 80,
        "block": 78
      },
      "tendencies": {
        "shootThree": 8,
        "shootMid": 20,
        "driveRim": 44,
        "pass": 34,
        "postUp": 52,
        "screen": 74,
        "helpDefense": 74,
        "gambleSteal": 30,
        "crashGlass": 80,
        "pushTransition": 36
      }
    }
  ]
}
