{
  "id": "harbor-city-wolves",
  "name": "Harbor City Wolves",
  "abbrev": "HCW",
  "players": [
    {
      "name": "Marcus Bell",
      "number": 3,
      "position": "PG",
      "height": 6.2,
      "attributes": {
        "speed": 88,
        "handleRight": 90,
        "handleLeft": 74,
        "pass": 89,
        "three": 82,
        "mid": 78,
        "finishing": 74,
        "perimD": 72,
        "steal": 76,
        "iq": 90,
        "strength": 55,
        "weight": 190,
        "vertical": 70,
        "rebound": 42,
        "interiorD": 45,
        "block": 35
      },
      "tendencies": {
        "shootThree": 60,
        "shootMid": 35,
        "driveRim": 55,
        "pass": 85,
        "postUp": 8,
        "screen": 15,
        "helpDefense": 45,
        "gambleSteal": 55,
        "crashGlass": 20,
        "pushTransition": 88
      }
    },
    {
      "name": "Tyrell Quinn",
      "number": 11,
      "position": "SG",
      "height": 6.4,
      "attributes": {
        "speed": 80,
        "handleRight": 75,
        "handleLeft": 57,
        "pass": 68,
        "three": 92,
        "mid": 80,
        "finishing": 70,
        "perimD": 64,
        "steal": 60,
        "iq": 78,
        "strength": 58,
        "weight": 200,
        "vertical": 72,
        "rebound": 44,
        "interiorD": 42,
        "block": 36
      },
      "tendencies": {
        "shootThree": 85,
        "shootMid": 45,
        "driveRim": 30,
        "pass": 45,
        "postUp": 5,
        "screen": 20,
        "helpDefense": 40,
        "gambleSteal": 45,
        "crashGlass": 22,
        "pushTransition": 75
      }
    },
    {
      "name": "Andre Foster",
      "number": 24,
      "position": "SF",
      "height": 6.7,
      "attributes": {
        "speed": 78,
        "handleLeft": 66,
        "handleRight": 48,
        "pass": 64,
        "three": 80,
        "mid": 70,
        "finishing": 76,
        "perimD": 88,
        "steal": 80,
        "iq": 82,
        "strength": 72,
        "weight": 225,
        "vertical": 80,
        "rebound": 62,
        "interiorD": 68,
        "block": 60
      },
      "tendencies": {
        "shootThree": 70,
        "shootMid": 30,
        "driveRim": 38,
        "pass": 45,
        "postUp": 12,
        "screen": 25,
        "helpDefense": 80,
        "gambleSteal": 65,
        "crashGlass": 40,
        "pushTransition": 70
      }
    },
    {
      "name": "Dario Vesely",
      "number": 41,
      "position": "PF",
      "height": 6.75,
      "attributes": {
        "speed": 68,
        "handleRight": 58,
        "handleLeft": 40,
        "pass": 60,
        "three": 84,
        "mid": 74,
        "finishing": 75,
        "perimD": 62,
        "steal": 54,
        "iq": 80,
        "strength": 74,
        "weight": 240,
        "vertical": 72,
        "rebound": 76,
        "interiorD": 70,
        "block": 66
      },
      "tendencies": {
        "shootThree": 72,
        "shootMid": 35,
        "driveRim": 32,
        "pass": 42,
        "postUp": 22,
        "screen": 55,
        "helpDefense": 60,
        "gambleSteal": 35,
        "crashGlass": 55,
        "pushTransition": 60
      }
    },
    {
      "name": "Olu Akindele",
      "number": 33,
      "position": "C",
      "height": 6.92,
      "attributes": {
        "speed": 74,
        "handleRight": 48,
        "handleLeft": 32,
        "pass": 52,
        "three": 35,
        "mid": 50,
        "finishing": 90,
        "perimD": 56,
        "steal": 50,
        "iq": 72,
        "strength": 84,
        "weight": 255,
        "vertical": 88,
        "rebound": 88,
        "interiorD": 86,
        "block": 85
      },
      "tendencies": {
        "shootThree": 4,
        "shootMid": 18,
        "driveRim": 60,
        "pass": 35,
        "postUp": 30,
        "screen": 80,
        "helpDefense": 78,
        "gambleSteal": 30,
        "crashGlass": 82,
        "pushTransition": 70
      }
    },
    {
      "name": "Cole Brennan",
      "number": 7,
      "position": "SF",
      "height": 6.6,
      "attributes": {
        "speed": 82,
        "handleRight": 78,
        "handleLeft": 60,
        "pass": 62,
        "three": 66,
        "mid": 72,
        "finishing": 84,
        "perimD": 70,
        "steal": 68,
        "iq": 74,
        "strength": 68,
        "weight": 215,
        "vertical": 86,
        "rebound": 56,
        "interiorD": 60,
        "block": 54
      },
      "tendencies": {
        "shootThree": 42,
        "shootMid": 40,
        "driveRim": 80,
        "pass": 40,
        "postUp": 14,
        "screen": 25,
        "helpDefense": 55,
        "gambleSteal": 58,
        "crashGlass": 45,
        "pushTransition": 82
      }
    },
    {
      "name": "Sam Pereira",
      "number": 15,
      "position": "PG",
      "height": 6.1,
      "attributes": {
        "speed": 84,
        "handleRight": 80,
        "handleLeft": 62,
        "pass": 78,
        "three": 74,
        "mid": 66,
        "finishing": 64,
        "perimD": 66,
        "steal": 70,
        "iq": 76,
        "strength": 52,
        "weight": 180,
        "vertical": 66,
        "rebound": 40,
        "interiorD": 44,
        "block": 32
      },
      "tendencies": {
        "shootThree": 58,
        "shootMid": 30,
        "driveRim": 50,
        "pass": 72,
        "postUp": 6,
        "screen": 18,
        "helpDefense": 48,
        "gambleSteal": 60,
        "crashGlass": 24,
        "pushTransition": 80
      }
    },
    {
      "name": "Boris Lindqvist",
      "number": 50,
      "position": "C",
      "height": 7.0,
      "attributes": {
        "speed": 58,
        "handleRight": 40,
        "handleLeft": 28,
        "pass": 48,
        "three": 40,
        "mid": 54,
        "finishing": 80,
        "perimD": 48,
        "steal": 42,
        "iq": 68,
        "strength": 86,
        "weight": 285,
        "vertical": 70,
        "rebound": 84,
        "interiorD": 82,
        "block": 80
      },
      "tendencies": {
        "shootThree": 10,
        "shootMid": 22,
        "driveRim": 40,
        "pass": 32,
        "postUp": 45,
        "screen": 78,
        "helpDefense": 72,
        "gambleSteal": 25,
        "crashGlass": 85,
        "pushTransition": 40
      }
    }
  ]
}
